{
  "input_manifest": {
    "files": [
      {
        "file_hash": "7c9a527f3fc6d9e857d8de96ab432ec98ec50020f4621bf0bd4755a969001a9c",
        "file_id": "f-id"
      },
      {
        "file_hash": "752cadf3ca58cf1a1479a02f7c02b503de33c5cfae3df17bfe9659b42a0949f8",
        "file_id": "f-pd-draft"
      },
      {
        "file_hash": "7c9a527f3fc6d9e857d8de96ab432ec98ec50020f4621bf0bd4755a969001a9c",
        "file_id": "f-pd"
      },
      {
        "file_hash": "1a524871b35568fb544c1995ae801d4087010dd7c3dbefbce0dbc1ae9f65b59a",
        "file_id": "f-rd"
      }
    ],
    "manifest_hash": "5e06a64dcfddec7aee99665ff90b75053d054b527f790eb7af7197902e6a4755"
  },
  "object_id": "OBJ-DEMO-COLD-START",
  "protocol_id": "protocol-example-unattended",
  "scenario": "PARTIALLY_LOADED",
  "sections": {
    "candidates": [],
    "completeness": [
      {
        "counts_as_violation": false,
        "expected_document": "Пояснительная записка",
        "finding_id": "completeness-ПЗ-PD",
        "finding_status": "STAGE_UPLOADED_NOT_VERIFIED",
        "kind": "section_catalog",
        "outcome": "STAGE_UPLOADED_NOT_VERIFIED",
        "rationale": "Каталог раздела ПЗ: ожидается «Пояснительная записка» на стадии PD; комплектность стадии = UPLOADED. Не нарушение.",
        "rule_code": "COMPLETENESS-ПЗ",
        "section_code": "ПЗ",
        "stage": "PD",
        "upload_state": "UPLOADED"
      },
      {
        "counts_as_violation": false,
        "expected_document": "ОД",
        "finding_id": "completeness-ПЗ-RD",
        "finding_status": "STAGE_UPLOADED_NOT_VERIFIED",
        "kind": "section_catalog",
        "outcome": "STAGE_UPLOADED_NOT_VERIFIED",
        "rationale": "Каталог раздела ПЗ: ожидается «ОД» на стадии RD; комплектность стадии = UPLOADED. Не нарушение.",
        "rule_code": "COMPLETENESS-ПЗ",
        "section_code": "ПЗ",
        "stage": "RD",
        "upload_state": "UPLOADED"
      },
      {
        "counts_as_violation": false,
        "expected_document": "Схема планировочной организации земельного участка",
        "finding_id": "completeness-СПЗУ-PD",
        "finding_status": "STAGE_UPLOADED_NOT_VERIFIED",
        "kind": "section_catalog",
        "outcome": "STAGE_UPLOADED_NOT_VERIFIED",
        "rationale": "Каталог раздела СПЗУ: ожидается «Схема планировочной организации земельного участка» на стадии PD; комплектность стадии = UPLOADED. Не нарушение.",
        "rule_code": "COMPLETENESS-СПЗУ",
        "section_code": "СПЗУ",
        "stage": "PD",
        "upload_state": "UPLOADED"
      },
      {
        "counts_as_violation": false,
        "expected_document": "ГП, ПП",
        "finding_id": "completeness-СПЗУ-RD",
        "finding_status": "STAGE_UPLOADED_NOT_VERIFIED",
        "kind": "section_catalog",
        "outcome": "STAGE_UPLOADED_NOT_VERIFIED",
        "rationale": "Каталог раздела СПЗУ: ожидается «ГП, ПП» на стадии RD; комплектность стадии = UPLOADED. Не нарушение.",
        "rule_code": "COMPLETENESS-СПЗУ",
        "section_code": "СПЗУ",
        "stage": "RD",
        "upload_state": "UPLOADED"
      },
      {
        "counts_as_violation": false,
        "expected_document": "Исполнительная схема благоустройства, АОСР",
        "finding_id": "completeness-СПЗУ-ID",
        "finding_status": "STAGE_UPLOADED_NOT_VERIFIED",
        "kind": "section_catalog",
        "outcome": "STAGE_UPLOADED_NOT_VERIFIED",
        "rationale": "Каталог раздела СПЗУ: ожидается «Исполнительная схема благоустройства, АОСР» на стадии ID; комплектность стадии = UPLOADED. Не нарушение.",
        "rule_code": "COMPLETENESS-СПЗУ",
        "section_code": "СПЗУ",
        "stage": "ID",
        "upload_state": "UPLOADED"
      },
      {
        "counts_as_violation": false,
        "expected_document": "Объемно-планировочные и архитектурные решения",
        "finding_id": "completeness-АР-PD",
        "finding_status": "STAGE_UPLOADED_NOT_VERIFIED",
        "kind": "section_catalog",
        "outcome": "STAGE_UPLOADED_NOT_VERIFIED",
        "rationale": "Каталог раздела АР: ожидается «Объемно-планировочные и архитектурные решения» на стадии PD; комплектность стадии = UPLOADED. Не нарушение.",
        "rule_code": "COMPLETENESS-АР",
        "section_code": "АР",
        "stage": "PD",
        "upload_state": "UPLOADED"
      },
      {
        "counts_as_violation": false,
        "expected_document": "АР",
        "finding_id": "completeness-АР-RD",
        "finding_status": "STAGE_UPLOADED_NOT_VERIFIED",
        "kind": "section_catalog",
        "outcome": "STAGE_UPLOADED_NOT_VERIFIED",
        "rationale": "Каталог раздела АР: ожидается «АР» на стадии RD; комплектность стадии = UPLOADED. Не нарушение.",
        "rule_code": "COMPLETENESS-АР",
        "section_code": "АР",
        "stage": "RD",
        "upload_state": "UPLOADED"
      },
      {
        "counts_as_violation": false,
        "expected_document": "Исполнительные поэтажные планы, АОСР",
        "finding_id": "completeness-АР-ID",
        "finding_status": "STAGE_UPLOADED_NOT_VERIFIED",
        "kind": "section_catalog",
        "outcome": "STAGE_UPLOADED_NOT_VERIFIED",
        "rationale": "Каталог раздела АР: ожидается «Исполнительные поэтажные планы, АОСР» на стадии ID; комплектность стадии = UPLOADED. Не нарушение.",
        "rule_code": "COMPLETENESS-АР",
        "section_code": "АР",
        "stage": "ID",
        "upload_state": "UPLOADED"
      },
      {
        "counts_as_violation": false,
        "expected_document": "Конструктивные решения",
        "finding_id": "completeness-КР-PD",
        "finding_status": "STAGE_UPLOADED_NOT_VERIFIED",
        "kind": "section_catalog",
        "outcome": "STAGE_UPLOADED_NOT_VERIFIED",
        "rationale": "Каталог раздела КР: ожидается «Конструктивные решения» на стадии PD; комплектность стадии = UPLOADED. Не нарушение.",
        "rule_code": "COMPLETENESS-КР",
        "section_code": "КР",
        "stage": "PD",
        "upload_state": "UPLOADED"
      },
      {
        "counts_as_violation": false,
        "expected_document": "КЖ, КМ, КК",
        "finding_id": "completeness-КР-RD",
        "finding_status": "STAGE_UPLOADED_NOT_VERIFIED",
        "kind": "section_catalog",
        "outcome": "STAGE_UPLOADED_NOT_VERIFIED",
        "rationale": "Каталог раздела КР: ожидается «КЖ, КМ, КК» на стадии RD; комплектность стадии = UPLOADED. Не нарушение.",
        "rule_code": "COMPLETENESS-КР",
        "section_code": "КР",
        "stage": "RD",
        "upload_state": "UPLOADED"
      },
      {
        "counts_as_violation": false,
        "expected_document": "АОСР, Акты освидетельствования конструкций, Журнал бетонных работ",
        "finding_id": "completeness-КР-ID",
        "finding_status": "STAGE_UPLOADED_NOT_VERIFIED",
        "kind": "section_catalog",
        "outcome": "STAGE_UPLOADED_NOT_VERIFIED",
        "rationale": "Каталог раздела КР: ожидается «АОСР, Акты освидетельствования конструкций, Журнал бетонных работ» на стадии ID; комплектность стадии = UPLOADED. Не нарушение.",
        "rule_code": "COMPLETENESS-КР",
        "section_code": "КР",
        "stage": "ID",
        "upload_state": "UPLOADED"
      },
      {
        "counts_as_violation": false,
        "expected_document": "Электроснабжение",
        "finding_id": "completeness-ИОС1-PD",
        "finding_status": "STAGE_UPLOADED_NOT_VERIFIED",
        "kind": "section_catalog",
        "outcome": "STAGE_UPLOADED_NOT_VERIFIED",
        "rationale": "Каталог раздела ИОС1: ожидается «Электроснабжение» на стадии PD; комплектность стадии = UPLOADED. Не нарушение.",
        "rule_code": "COMPLETENESS-ИОС1",
        "section_code": "ИОС1",
        "stage": "PD",
        "upload_state": "UPLOADED"
      },
      {
        "counts_as_violation": false,
        "expected_document": "ЭОМ",
        "finding_id": "completeness-ИОС1-RD",
        "finding_status": "STAGE_UPLOADED_NOT_VERIFIED",
        "kind": "section_catalog",
        "outcome": "STAGE_UPLOADED_NOT_VERIFIED",
        "rationale": "Каталог раздела ИОС1: ожидается «ЭОМ» на стадии RD; комплектность стадии = UPLOADED. Не нарушение.",
        "rule_code": "COMPLETENESS-ИОС1",
        "section_code": "ИОС1",
        "stage": "RD",
        "upload_state": "UPLOADED"
      },
      {
        "counts_as_violation": false,
        "expected_document": "Акты испытания технических устройств, Исполнительные схемы сетей",
        "finding_id": "completeness-ИОС1-ID",
        "finding_status": "STAGE_UPLOADED_NOT_VERIFIED",
        "kind": "section_catalog",
        "outcome": "STAGE_UPLOADED_NOT_VERIFIED",
        "rationale": "Каталог раздела ИОС1: ожидается «Акты испытания технических устройств, Исполнительные схемы сетей» на стадии ID; комплектность стадии = UPLOADED. Не нарушение.",
        "rule_code": "COMPLETENESS-ИОС1",
        "section_code": "ИОС1",
        "stage": "ID",
        "upload_state": "UPLOADED"
      },
      {
        "counts_as_violation": false,
        "expected_document": "Водоснабжение",
        "finding_id": "completeness-ИОС2-PD",
        "finding_status": "STAGE_UPLOADED_NOT_VERIFIED",
        "kind": "section_catalog",
        "outcome": "STAGE_UPLOADED_NOT_VERIFIED",
        "rationale": "Каталог раздела ИОС2: ожидается «Водоснабжение» на стадии PD; комплектность стадии = UPLOADED. Не нарушение.",
        "rule_code": "COMPLETENESS-ИОС2",
        "section_code": "ИОС2",
        "stage": "PD",
        "upload_state": "UPLOADED"
      },
      {
        "counts_as_violation": false,
        "expected_document": "ВК",
        "finding_id": "completeness-ИОС2-RD",
        "finding_status": "STAGE_UPLOADED_NOT_VERIFIED",
        "kind": "section_catalog",
        "outcome": "STAGE_UPLOADED_NOT_VERIFIED",
        "rationale": "Каталог раздела ИОС2: ожидается «ВК» на стадии RD; комплектность стадии = UPLOADED. Не нарушение.",
        "rule_code": "COMPLETENESS-ИОС2",
        "section_code": "ИОС2",
        "stage": "RD",